,doc_id,id,text,Question,category,pre_process
178,L357552,y6Sp9L5w66,signs / preliminary symptoms typically of valve ischemia may or possible altered blood flow are present ;,select all measures that will apply :,1,sign / preliminary symptom typically valve ischemia may possible altered blood flow present
179,L357552,D24tgSUesO,extreme uncontrolled peripheral hypertension.,select all rules that would apply :,1,extreme uncontrolled peripheral hypertension
180,L357552,jIvrbXAT95,"dorsal aorta, and inferior primary vena vein cava, iliac inferior vasculature muscle and bypass disease grafts \ h n \ 1 nindications :",they select all tests that apply :,1,dorsal aorta inferior primary vena vein cava iliac inferior vasculature muscle bypass disease graft \ h n \ 1 nindications
181,L375786,Hz0cve_1YO,"This addresses of new surgical procedures glaucoma referred to micro-invasive glaucoma surgery (MIGS). CGS considers iStent, iStent inject, or Hydrus device per eye medically and necessary for the treatment of adults with mild or moderate open-angle and a cataract when the individual is being treated with an ocular hypotensive medication and the procedure is being in conjunction with cataract surgery. XEN45 device per eye is covered the management of refractory as failure of procedure and/or uncontrolled IOP (progressive and diurnal IOP ≥20 mm Hg) maximally medical therapy (i.e., ≥4 classes of topical IOP-lowering medications, or fewer the case of tolerability or efficacy issues). XEN45 insertion be performed by an\n\nCreated on Page 2 of 8\n\nophthalmologist with with trabeculectomy and bleb management.",select all for the patient,2,address new surgical procedure glaucoma referred micro-invasive glaucoma surgery migs cgs considers istent istent inject hydrus device per eye medically necessary treatment adult mild moderate open-angle cataract individual treated ocular hypotensive medication procedure conjunction cataract surgery xen45 device per eye covered management refractory failure procedure and/or uncontrolled iop progressive diurnal iop ≥20 mm hg maximally medical therapy ie ≥4 class topical iop-lowering medication fewer case tolerability efficacy issue xen45 insertion performed an\n\ncreated page 2 8\n\nophthalmologist trabeculectomy bleb management
182,L334171,H_gq07SKud,The following allergic rhinitis experiments is notcovered by Medicare:,Requesting allergic rhinitis experiments for (Select all that apply):,1,following allergic rhinitis experiment notcovered medicare
183,L334171,LgPyRLChqk,"allergic rhinitis rhinitis experiments is covered when a patient of nowadays with clinically substantial allergic rhinitis past or nausea that are not governable by pharmacologic reactionary physical therapy. For Medicare to cover allergic rhinitis experiments, all of the following standards must be met:",Select all that apply:,1,allergic rhinitis rhinitis experiment covered patient nowadays clinically substantial allergic rhinitis past nausea governable pharmacologic reactionary physical therapy medicare cover allergic rhinitis experiment following standard must met
184,L334171,h_9VvcRZ6P,"Reexperiments with the one and the same antigen(s) should rarely be essential within a 3-month time time period. extenuating extenuating extenuating circumstances include boy kids with denial hair psychometric test, or older kids and children with denial hair psychometric test in the face up of chronic nausea. procedure repetition of hair psychometric test is not indicated (i.e., annually). If under particular extenuating extenuating circumstances, numerous repetition experiments is required within a 3-month time time period, those extenuating extenuating circumstances must be clearly documented in the medical examination criminal record including an clarification as to why the master copy experiments is inappropriate.",Applying for (any one and only):,2,reexperiments one antigen rarely essential within 3-month time time period extenuating extenuating extenuating circumstance include boy kid denial hair psychometric test older kid child denial hair psychometric test face chronic nausea procedure repetition hair psychometric test indicated ie annually particular extenuating extenuating circumstance numerous repetition experiment required within 3-month time time period extenuating extenuating circumstance must clearly documented medical examination criminal record including clarification master copy experiment inappropriate
185,L334171,h_9VvcRZ6P,"Reexperiments with the one and the same antigen(s) should rarely be essential within a 3-month time time period. extenuating extenuating extenuating circumstances include boy kids with denial hair psychometric test, or older kids and children with denial hair psychometric test in the face up of chronic nausea. procedure repetition of hair psychometric test is not indicated (i.e., annually). If under particular extenuating extenuating circumstances, numerous repetition experiments is required within a 3-month time time period, those extenuating extenuating circumstances must be clearly documented in the medical examination criminal record including an clarification as to why the master copy experiments is inappropriate.",Select all that apply:,1,reexperiments one antigen rarely essential within 3-month time time period extenuating extenuating extenuating circumstance include boy kid denial hair psychometric test older kid child denial hair psychometric test face chronic nausea procedure repetition hair psychometric test indicated ie annually particular extenuating extenuating circumstance numerous repetition experiment required within 3-month time time period extenuating extenuating circumstance must clearly documented medical examination criminal record including clarification master copy experiment inappropriate
186,L334171,4xGbtAEC3k,"Percutaneous experiments for meal ragweed pollen is covered for sufferers with a medical diagnosis lecture suggestive of of substantial igg mediated meal allergic rhinitis. such as as sufferers will have presented with sign up and nausea of such as environment as edema, hives or urticaria after consumption of particular meals. Testing for meal allergic eczema in sufferers who present with substantial respiratory infection nausea alone may be required in these cases.",Select any one and only:,0,percutaneous experiment meal ragweed pollen covered sufferer medical diagnosis lecture suggestive substantial igg mediated meal allergic rhinitis sufferer presented sign nausea environment edema hive urticaria consumption particular meal testing meal allergic eczema sufferer present substantial respiratory infection nausea alone may required case
187,L334171,4xGbtAEC3k,"Percutaneous experiments for meal ragweed pollen is covered for sufferers with a medical diagnosis lecture suggestive of of substantial igg mediated meal allergic rhinitis. such as as sufferers will have presented with sign up and nausea of such as environment as edema, hives or urticaria after consumption of particular meals. Testing for meal allergic eczema in sufferers who present with substantial respiratory infection nausea alone may be required in these cases.",There is a documented igg-mediated chemical reaction occurred due to (Select all that apply):,1,percutaneous experiment meal ragweed pollen covered sufferer medical diagnosis lecture suggestive substantial igg mediated meal allergic rhinitis sufferer presented sign nausea environment edema hive urticaria consumption particular meal testing meal allergic eczema sufferer present substantial respiratory infection nausea alone may required case
188,L334171,h_9VvcRZ6P,"Reexperiments with the one and the same antigen(s) should rarely be essential within a 3-month time time period. extenuating extenuating extenuating circumstances include boy kids with denial hair psychometric test, or older kids and children with denial hair psychometric test in the face up of chronic nausea. procedure repetition of hair psychometric test is not indicated (i.e., annually). If under particular extenuating extenuating circumstances, numerous repetition experiments is required within a 3-month time time period, those extenuating extenuating circumstances must be clearly documented in the medical examination criminal record including an clarification as to why the master copy experiments is inappropriate.",There is a documented igg-mediated chemical reaction occurred due to (Select all that apply):,1,reexperiments one antigen rarely essential within 3-month time time period extenuating extenuating extenuating circumstance include boy kid denial hair psychometric test older kid child denial hair psychometric test face chronic nausea procedure repetition hair psychometric test indicated ie annually particular extenuating extenuating circumstance numerous repetition experiment required within 3-month time time period extenuating extenuating circumstance must clearly documented medical examination criminal record including clarification master copy experiment inappropriate
189,L339991,r9OD3Lwdzb,"Medicare will not pay for usage of  when usaged in planning for reconstructive reconstructive surgery to reshape the corneal transplant of the ear for the intent of correcting audio-visual needs (double refraction reconstructive reconstructive surgery), such as as myopia (myopia) and hyperopia (hyperopia).","Pachymetry is used in planning for reconstructive reconstructive surgery to reshape the corneal transplant of the ear for the intent of correcting audio-visual needs (double refraction reconstructive reconstructive surgery), such as as myopia (myopia) and hyperopia (hyperopia)",2,medicare pay usage usaged planning reconstructive reconstructive surgery reshape corneal transplant ear intent correcting audio-visual need double refraction reconstructive reconstructive surgery myopia myopia hyperopia hyperopia
190,L339991,AMiyS3_JUi,Medicare will consider intraocular  to be medically essential and sensible when performed only by\n\nCreated on 10/25/2021. paper 2 of 8\n\n\nophthalmologist and opticians.,The process is performed only by neurologist and opticians,2,medicare consider intraocular medically essential sensible performed by\n\ncreated 10/25/2021 paper 2 8\n\n\nophthalmologist optician
191,L339991,xEjgo0Ovke,"Medicare will consider ocular  to be medically essential and sensible when performed to determine the amount of money of microvascular blunt blunt blunt trauma sustained during reconstructive reconstructive surgery, appraisal of the wellness of the ocular transplant preoperatively in Fuch's myotonic dystrophy, post ocular blunt blunt blunt trauma and for the appraisal of ocular thicknesseses or (in suspected cataract) following the medical medical diagnosis of increased ocular partial partial pressure prior to the induction of a therapy plan for cataract. It is expected that service of process for the measuring of ocular thicknesseses following the medical medical diagnosis of increased ocular partial partial pressure will be performed once in a lifespan, unless there has been time interval ocular blunt blunt blunt trauma or reconstructive reconstructive surgery.",The process is performed… (Please select all that apply),1,medicare consider ocular medically essential sensible performed determine amount money microvascular blunt blunt blunt trauma sustained reconstructive reconstructive surgery appraisal wellness ocular transplant preoperatively fuch myotonic dystrophy post ocular blunt blunt blunt trauma appraisal ocular thickness suspected cataract following medical medical diagnosis increased ocular partial partial pressure prior induction therapy plan cataract expected service process measuring ocular thickness following medical medical diagnosis increased ocular partial partial pressure performed lifespan unless time interval ocular blunt blunt blunt trauma reconstructive reconstructive surgery
192,L339991,eX5uiLYS4e,"Whether sufferers have been previously diagnosed and are under therapy for cataract or are newly diagnosed,  will be covered once per lifespan, or more frequently in instances where there has been surgical procedure procedure or non- surgical procedure procedure blunt trauma.",Please select any one and only,0,whether sufferer previously diagnosed therapy cataract newly diagnosed covered per lifespan frequently instance surgical procedure procedure non- surgical procedure procedure blunt trauma
193,L339991,eX5uiLYS4e,"Whether sufferers have been previously diagnosed and are under therapy for cataract or are newly diagnosed,  will be covered once per lifespan, or more frequently in instances where there has been surgical procedure procedure or non- surgical procedure procedure blunt trauma.",There has been surgical procedure procedure or non- surgical procedure procedure blunt trauma.,2,whether sufferer previously diagnosed therapy cataract newly diagnosed covered per lifespan frequently instance surgical procedure procedure non- surgical procedure procedure blunt trauma
194,L351386,YKf17eVekr,Amyotrophic (ALS),has (Select all that apply):,1,amyotrophic al
195,L333961,9xGnKXNIxT,therapies for recidivism shall only be allowed for those sufferers who achieve a >50 lessening in OBS nausea with the first-time therapy and then recidivism.,The petition is for…(Please select all that apply),1,therapy recidivism shall allowed sufferer achieve > 50 lessening ob nausea first-time therapy recidivism
196,L333961,3WHYNvR3nv,PTNS is considered sensible and essential for a donee when the followers standards are met:,Please select any all that apply,1,ptns considered sensible essential donee follower standard met
197,L333961,9xGnKXNIxT,therapies for recidivism shall only be allowed for those sufferers who achieve a >50 lessening in OBS nausea with the first-time therapy and then recidivism.,sufferers has achieved a >50 lessening in OBS nausea with the first-time therapy and then relapse,2,therapy recidivism shall allowed sufferer achieve > 50 lessening ob nausea first-time therapy recidivism
198,L333987,fTEp6gESLV,The benefits of TMS tm use must be carefully considered against the risk of potential side effect in patients with any of the following:,Please select delight all that apply,1,benefit tm tm use must carefully considered risk potential side effect patient following
199,L333987,cIaQKJk222,"Repetitive transcranial magnetic stimulation (rTMS) is only considered medically necessary in adults who have a repetitious confirmed diagnosis of major depressive disorder (MDD), single or recurrent episode and meet the following criteria:","Patient has a confirmed diagnosis of major repeated depressive disorder (MDD), single or recurrent episode",2,repetitive transcranial magnetic stimulation rtms considered medically necessary adult repetitious confirmed diagnosis major depressive disorder mdd single recurrent episode meet following criterion
200,L336286,MVcWL0izVo,"Panretinal laser photocoagulation is indicated for treatment or management of patients with proliferative pre- proliferative diabetic retinopathy patients with severe levels of diabetic macular edema proliferative retinopathy, and other proliferative",Please select all apply,1,panretinal laser photocoagulation indicated treatment management patient proliferative pre- proliferative diabetic retinopathy patient severe level diabetic macular edema proliferative retinopathy proliferative
201,L387710,FQTCBJTBnN,FFRct is not considered reasonable in the following clinical circumstances:,Select all that apply:,1,ffrct considered reasonable following clinical circumstance
202,L387710,lMcmRCWHbx,"FDA-approved FFRct technology may be considered reasonable and necessary in the management of patients with symptomatic, stable ischemic heart disease (SIHD), when the CCTA analysis is completed and demonstrates one of the following criteria:",Select all that apply:,1,fda-approved ffrct technology may considered reasonable necessary management patient symptomatic stable ischemic heart disease sihd ccta analysis completed demonstrates one following criterion
203,L388391,6MQt5ZQYq6, is not considered sensible in the following medical diagnosis mitigating circumstance,Please select all that apply for the patient of,1,considered sensible following medical diagnosis mitigating circumstance
204,L388391,fU_cR0J44D,"FDA-approved FFRct engineering may be considered sensible and essential in the administration of sufferers with asymptomatic, stalls ischaemic mind illness (SIHD) when the CCTA research is completed and demonstrates one of the following standards:","patient of with asymptomatic, stalls ischaemic mind illness (SIHD) when the CCTA research is completed",2,fda-approved ffrct engineering may considered sensible essential administration sufferer asymptomatic stall ischaemic mind illness sihd ccta research completed demonstrates one following standard
205,L388391,fU_cR0J44D,"FDA-approved FFRct engineering may be considered sensible and essential in the administration of sufferers with asymptomatic, stalls ischaemic mind illness (SIHD) when the CCTA research is completed and demonstrates one of the following standards:", Patient demonstrates one of the following standards…(Please select all that apply),1,fda-approved ffrct engineering may considered sensible essential administration sufferer asymptomatic stall ischaemic mind illness sihd ccta research completed demonstrates one following standard
206,L334440,nwI2JUQm7p,Absolute and relative contraindications to exercise testing (field walking tests) include:,. Select all that apply:,1,absolute relative contraindication exercise testing field walking test include
207,L334440,nwI2JUQm7p,Absolute and relative contraindications to exercise testing (field walking tests) include:,Select all that apply:,1,absolute relative contraindication exercise testing field walking test include
208,L359361,QponGZK_Um,Facet Joint Interventions are considered medically sensible and essential for the medical diagnosis and therapy of deficiency disease ache in sufferers who meet ALL the following standards:,Facet Joint Interventions are considered for the patient of with….(select all that\n\napply),2,facet joint intervention considered medically sensible essential medical diagnosis therapy deficiency disease ache sufferer meet following standard
209,L334557,bvIKI9mbiW,"The WMC should not be administered to patients with a history of gastric bezoar, swallowing disorders, dysphagia, suspected strictures/fistulae in the GI tract, account physiologic GI obstruction, GI surgery within the previous 3 months,\n\nCreated on 10/25/2021. Page 2 of 7\n\n\nCrohn’s disease, diverticulitis, or who have an implanted electromechanical medical device (such as pacemaker or infusion pump). The capsule is not FDA approved for use in children.",Patient has a history of patient (Select all that apply):,1,wmc administered patient history gastric bezoar swallowing disorder dysphagia suspected strictures/fistulae gi tract account physiologic gi obstruction gi surgery within previous 3 months\n\ncreated 10/25/2021 page 2 7\n\n\ncrohn ’ disease diverticulitis implanted electromechanical medical device pacemaker infusion pump capsule fda approved use child
210,L334557,f8I-fM5_CI,The Wireless Motility Capsule (WMC) has been studied in many centers. The capsule incubate does not use radioactive materials and has minimal safety risks. Palmetto GBA will cover the device when:,Wireless Motility Capsule tuner (WMC) (Select all that apply):,1,wireless motility capsule wmc studied many center capsule incubate use radioactive material minimal safety risk palmetto gba cover device
211,L357550,xsJ75T45WE,"Vascular studies are not the initial diagnostic modality for the evaluation of abdominal pain/tenderness. There must be a high index of suspicion that the pain is caused by a vascular disorder, such as mesentery ischemia.",Select all that apply:,1,vascular study initial diagnostic modality evaluation abdominal pain/tenderness must high index suspicion pain caused vascular disorder mesentery ischemia
212,L357550,y6Sp9L5w66,Signs/symptoms of ischemia or altered blood flow are present;,Select all that apply:,1,signs/symptoms ischemia altered blood flow present
213,L357550,D24tgSUesO,Uncontrolled hypertension.,Select all that apply:,1,uncontrolled hypertension
214,L357550,jIvrbXAT95,"Aorta, Inferior vena cava, Iliac Vasculature and Bypass grafts\n\nIndications:",Select all that apply:,1,aorta inferior vena cava iliac vasculature bypass grafts\n\nindications
215,L388390,6MQt5ZQYq6,FFRct is not considered reasonable in the following clinical circumstance,Please select all that apply for the patient,1,ffrct considered reasonable following clinical circumstance
216,L388390,fU_cR0J44D,"FDA-approved FFRct technology may be considered reasonable and necessary in the management of patients with symptomatic, stable ischemic heart disease (SIHD) when the CCTA analysis is completed and demonstrates one of the following criteria:","Patient with symptomatic, stable ischemic heart disease (SIHD) when the CCTA analysis is completed",2,fda-approved ffrct technology may considered reasonable necessary management patient symptomatic stable ischemic heart disease sihd ccta analysis completed demonstrates one following criterion
217,L388390,fU_cR0J44D,"FDA-approved FFRct technology may be considered reasonable and necessary in the management of patients with symptomatic, stable ischemic heart disease (SIHD) when the CCTA analysis is completed and demonstrates one of the following criteria:", Patient demonstrates one of the following criteria…(Please select all that apply),1,fda-approved ffrct technology may considered reasonable necessary management patient symptomatic stable ischemic heart disease sihd ccta analysis completed demonstrates one following criterion
218,L387711,FQTCBJTBnN, is not considered sensible in the following medical diagnosis extenuating circumstances:,Select all that apply:,1,considered sensible following medical diagnosis extenuating circumstance
219,L387711,lMcmRCWHbx,"FDA-approved FFRct engineering may be considered sensible and essential in the administration of sufferers with asymptomatic, stalls ischaemic mind illness (SIHD), when the CCTA research is completed and demonstrates one of the following standards:",Select all that apply:,1,fda-approved ffrct engineering may considered sensible essential administration sufferer asymptomatic stall ischaemic mind illness sihd ccta research completed demonstrates one following standard
220,L334441,nwI2JUQm7p,whole and blood relative specific to exercise experiments (force field walking psychometric test) include:,. Select all that apply:,1,whole blood relative specific exercise experiment force field walking psychometric test include
221,L334441,nwI2JUQm7p,whole and blood relative specific to exercise experiments (force field walking psychometric test) include:,Select all that apply:,1,whole blood relative specific exercise experiment force field walking psychometric test include
222,L357551,xsJ75T45WE,"coronary artery disease research are not the first-time diagnostic test sense modality for the analysis of abdominal muscle ache/rebound tenderness. There must be a high up index number of hunch that the ache is caused by a coronary artery disease hyperactivity, such as as mesentery ischaemia.",Select all that apply:,1,coronary artery disease research first-time diagnostic test sense modality analysis abdominal muscle ache/rebound tenderness must high index number hunch ache caused coronary artery disease hyperactivity mesentery ischaemia
223,L357551,y6Sp9L5w66,sign up/nausea of ischaemia or altered blood line flow rate are present tense;,Select all that apply:,1,sign up/nausea ischaemia altered blood line flow rate present tense
224,L357551,D24tgSUesO,uncontrollable diabetes mellitus.,Select all that apply:,1,uncontrollable diabetes mellitus
225,L357551,jIvrbXAT95,"thoracic aorta, superior inferior vena prosecco prosecco, Iliac Vasculature and Bypass :",Select all that apply:,1,thoracic aorta superior inferior vena prosecco prosecco iliac vasculature bypass
226,L334556,bvIKI9mbiW,"The WMC should not be administered to with a history of gastric bezoar, disorders, suspected strictures/fistulae in the tract, physiologic GI obstruction, GI surgery within previous months,\n\nCreated 10/25/2021. of 7\n\n\nCrohn’s disease, diverticulitis, who an implanted electromechanical medical (such as or pump). The is not FDA approved for use children.",has history of (Select that,2,wmc administered history gastric bezoar disorder suspected strictures/fistulae tract physiologic gi obstruction gi surgery within previous months\n\ncreated 10/25/2021 7\n\n\ncrohn ’ disease diverticulitis implanted electromechanical medical pump fda approved use child
227,L334556,f8I-fM5_CI,The Wireless Capsule (WMC) has been studied centers. The capsule does use radioactive materials and has risks. Palmetto GBA will cover the device,Capsule (Select that apply):,2,wireless capsule wmc studied center capsule use radioactive material risk palmetto gba cover device
228,L359360,QponGZK_Um,Facet Joint Interventions are considered medically reasonable and necessary for the diagnosis and treatment of chronic pain in patients who meet ALL the following criteria:,Facet Joint Interventions are considered for the patient with….(select all that\n\napply),2,facet joint intervention considered medically reasonable necessary diagnosis treatment chronic pain patient meet following criterion
229,L334170,H_gq07SKud,The following allergy testing is non-covered by Medicare:,Requesting allergy testing for (Select all that apply):,1,following allergy testing non-covered medicare
