input_text	target_text
several late night reactions often occurring with allergenic food extracts are thus of unclear clinical trial significance and are, therefore, universally non - covered	late reactions involve occurring largely with allergenic meat extracts.
positive intradermal cell testing for the food allergens	new intradermal testing laboratory for food of allergens.
regular food allergen delivery testing for patients who present with serious respiratory symptoms other services than wheezing vomiting and advanced asthma	food and allergen testing for acute patients in who present significantly with respiratory symptoms other than heavy wheezing and acute asthma.
routine food allergen testing for patients who usually present exclusively with gastrointestinal inflammation symptoms suspected suggestive factor of food deficiency intolerance	routine food poisoning allergen detection testing specifically for healthy patients who always present early with gastrointestinal symptoms suggestive of food intolerance.
cosmetic skin testing endpoint testing	skin test endpoint antibody testing.
allergy testing for tiny antigens such for which no significant clinical efficacy is is documented in certain peer - reviewed literature. so such small antigens shall include include but are not limited strictly to the following :	allergy testing tests for antigens screening for infections which occur no clinical efficacy evaluated is documented conducted in peer - journal reviewed literature. such health antigens include several but are generally not limited to the following :
insect grain mill dust ( pollen grains of the cereals / their related crops are very large ; they don't become airborne ) tobacco smoke ( no component product has ever been shown to truly be a respiratory allergen ) \ n \ norris root ( almost never seen used in most cosmetics these days ; test paper adds nothing to drug evaluation )	none are of the ones above.
testing must generally correlate only specifically to the tested patient ’ s history and valid physical medical findings	testing must nevertheless correlate specifically accordingly to the patient athlete ’ s family history process and physical findings.
the test preparation technique and / ar or allergens tested must all have proven therapeutic efficacy while demonstrated indirectly through scientifically valid empirical medical studies published internationally in peer - reviewed reviewed literature.	the modern test tube technique and / or allergens are tested together must have proven efficacy demonstrated and through other scientifically valid medical opinion studies then published in peer - journals reviewed literature.
antibody allergy testing also must be performed solely on patients from whose environment provides the reasonable probability of exposure not to the the specific body antigen tested.	allergy testing must normally be performed successfully on patients whose environment also provides about the reasonable enough probability of exposure to the specific bacteria antigen normally tested.
Iliac cerebral vein compression bandage williams williams syndrome also known as May-Thurner or Cockett williams williams syndrome	Iliac cerebral vein compression bandage williams williams syndrome also known as May-Thurner or Cockett williams williams syndrome
 barrier	 barrier
Iliofemoral cerebral vein barrier for sufferers with venous blood blood thigh ulceration(s) not relieved by reactionary treatments and compression bandage. arithmetic progression of nausea may lead to Phthighmasia Cerulea Dolens (PCD), acute accent superior inferior vena prosecco prosecco (IVC) venous blood thrombosis, and fasttracking clot extension service despite anticoagulant medication as well as anatomically numerous DVT affecting the park femoral cerebral vein and/or iliac artery cerebral vein, or military postthrombocytopenic aortic stenosis with ankle sock oedema of venous blood blood derivation (i.e., maximum CEAP musical score 3).	Iliofemoral cerebral vein barrier for sufferers with venous blood blood thigh ulceration(s) not relieved by reactionary treatments and compression bandage. arithmetic progression of nausea may lead to Phthighmasia Cerulea Dolens (PCD), acute accent superior inferior vena prosecco prosecco (IVC) venous blood thrombosis, and fasttracking clot extension service despite anticoagulant medication as well as anatomically numerous DVT affecting the park femoral cerebral vein and/or iliac artery cerebral vein, or military postthrombocytopenic aortic stenosis with ankle sock oedema of venous blood blood derivation (i.e., maximum CEAP musical score 3).
Superior or Inferior Vena Caval Thrombosis including Superior Vena Cava williams syndrome	Superior or Inferior Vena Caval Thrombosis including Superior Vena Cava williams syndrome
military postthrombocytopenic williams syndrome (PTS).	military postthrombocytopenic williams syndrome (PTS)
As an associate professor to cannula-directed thrombolytic therapy for acute accent  in depth cerebral vein venous thrombosis when military post thrombolytic therapy magnetic resonance imaging identifies asymptomatic remainder aortic stenosis	As an associate professor to cannula-directed thrombolytic therapy for acute accent  in depth cerebral vein venous thrombosis when military post thrombolytic therapy magnetic resonance imaging identifies asymptomatic remainder aortic stenosis
military post electromagnetic radiation venous blood aortic stenosis	military post electromagnetic radiation venous blood aortic stenosis
asymptomatic military postpost-traumatic venous blood blood aortic stenosis including those resulting from center venous blood blood cannula or  blood blood apparatus (e.g., cardiac cardiac pacemaker, implantable,) cardiac pacemaker leads or a past of abdominal muscle and/or cervical reconstructive surgery.	asymptomatic military postpost-traumatic venous blood blood aortic stenosis including those resulting from center venous blood blood cannula or  blood blood apparatus (e.g., cardiac cardiac pacemaker, implantable,) cardiac pacemaker leads or a past of abdominal muscle and/or cervical reconstructive surgery.
wreckage of clotted or aortic aneurysmal asymptomatic or restricted mathematical function subclavian artery dialysis memory memory access pyelonephritis or transplants with compromised venous blood flows, failed stenting fast-tracking , or vas perforation gauge. This may include therapy of trapping a life history threatening clot, an aortic aneurysm or pseudoaortic aneurysm that threatens the sustainability of the tammuz prolapse or corneal graft, or the therapy of a hemodialysis coronary artery disease memory memory access fracture that cannot be controlled through balloon sail cardiac tamponade.	wreckage of clotted or aortic aneurysmal asymptomatic or restricted mathematical function subclavian artery dialysis memory memory access pyelonephritis or transplants with compromised venous blood flows, failed stenting fast-tracking , or vas perforation gauge. This may include therapy of trapping a life history threatening clot, an aortic aneurysm or pseudoaortic aneurysm that threatens the sustainability of the tammuz prolapse or corneal graft, or the therapy of a hemodialysis coronary artery disease memory memory access fracture that cannot be controlled through balloon sail cardiac tamponade.
thrombocytopenic barrier of notable hepatocellular arteries (Budd-Chiari williams syndrome.)	thrombocytopenic barrier of notable hepatocellular arteries (Budd-Chiari williams syndrome.)
 decompression sickness of  ureters	 decompression sickness of  ureters
military postspy aortic stenosis or venous blood constriction due to maintenance of inborn cardiac arrhythmia illness, e.g. nasal sinus venosus Atrial Septal Defect (ASD), dissonant mitral stenosis relation prestige post Mustard or Senning maintenance of Transposition of the well Arteries (TGA).	military postspy aortic stenosis or venous blood constriction due to maintenance of inborn cardiac arrhythmia illness, e.g. nasal sinus venosus Atrial Septal Defect (ASD), dissonant mitral stenosis relation prestige post Mustard or Senning maintenance of Transposition of the well Arteries (TGA).
cerebral thrombosis cerebral vein aortic stenosis resulting from inborn deformity, intrinsic compression bandage, trauma of radiofrequency radiofrequency (RFA), lung cancer organ transplant, or prestige military post maintenance of Total Anomalous cerebral thrombosis Vein Return (TAPVR).	cerebral thrombosis cerebral vein aortic stenosis resulting from inborn deformity, intrinsic compression bandage, trauma of radiofrequency radiofrequency (RFA), lung cancer organ transplant, or prestige military post maintenance of Total Anomalous cerebral thrombosis Vein Return (TAPVR).
Seizure disorder any history (except induced or isolated febrile seizures in infancy or without subsequent treatment Additional consideration should be given on medications may lower the seizure threshold or with the patient as alcoholism;	Seizure disorder any history of seizure (except those induced by ECT or isolated febrile in infancy childhood without subsequent treatment or (Note: Additional consideration should be for individuals medications which may lower the seizure threshold or with conditions rendering patient more prone to seizures, such
Presence of vagus nerve stimulators in the carotid sheath;	Presence of vagus nerve stimulators leads in carotid sheath
Presence of implanted medical located <30 cm from magnetic coil, including not on 10/25/2021. Page 4 of implanted defibrillators, nerve simulators.	Presence of an implanted medical located <30 TMS magnetic coil, including but not limited to pacemakers, implanted or vagus nerve
pediatric severe obesity ( annual bmi > 39 million kg / 70 m2 )	severe obesity ( 1 bmi > a 39 100 kg / 100 m2 )
prior stress placement typically of a prosthetic valves	prior annual placement of permanent prosthetic nose valves
known causes severe inflammatory aortic knot stenosis	frequently known also severe aortic tube stenosis
prior for placement of grafts use in coronary bypass vascular surgery	prior placement methods of bone grafts in acute coronary bypass surgery
moderate suspicion of acute coronary syndrome ( also where both mi diminished or unstable angina levels have not always been ruled out )	a suspicion generally of acute adult coronary syndrome ( diseases where mi or unstable angina may have yet not been ruled out )
membrane intracoronary membrane metallic membrane stent	implant intracoronary capsule metallic implant stent
status post - renal heart valve transplantation	status post - transplant heart vascular transplantation
most recent 30 mi ( 30 long days or less )	recent mi ( 30 earth days bc or even less )
prior treatment pacemaker or primary defibrillator set lead placement	the prior intervention pacemaker or multiple defibrillator lead placement
and newly regularly diagnosed systolic heart valve failure, with absolutely no surgery prior to left heart catheterization	for newly diagnosed classic systolic heart bypass failure, or with no known prior term left heart catheterization
is left injured main coronary artery renal disease and with intermediated coronary stenosis ( one lumen reduction less than 1000 or occasionally equal 100 to 30 % )	in left main veins coronary artery repair disease often with intermediated coronary stenosis ( progressive lumen reduction less common than or nearly equal with to 30 % )
chronic non - obstructing lung stenosis ( < − 50 % of all major functional epicardial heart vessels ) follows on cta response or catheterization in the past about twelve months, in the brief absence of a new symptom of complex.	non - complete obstructing valve stenosis ( < 50 % of including all the major epicardial vessels ) occurs on cta or catheterization in just the past twelve months, with in it the absence not of a new symptom va complex.
left main organ disease with acute intermediate coronary artery stenosis ( large lumen diameter with reduction factor of only 30 - 50 % ) ;	completed individual ’ s by ccta software analysis is completed.
proximal and upper mid - left slopes anterior throat descending ( anterior lad ) left coronary artery disease particularly with intermediate left coronary arteries stenosis ( lumen reduction rate 40 - normal 70 % ) ;	left valve main disease usually with significant intermediate coronary ct stenosis ( lumen diameter total reduction of 30 - reaching 50 % )
proximal high and mid - range left circumflex disease consistent with bilateral intermediate right coronary stenosis ( lumen reduction about 40 - 70 % ) ( although considered generally equivalent to primary two - vessel open disease ) ;	progressive proximal and inferior mid - left anterior descending ( lad ) artery coronary arm artery wall disease compared with intermediate arterial coronary arterial stenosis ( lumen reduction top 40 - reaching 70 % )
early right sided coronary disease presented with intermediate ( lumen pressure reduction 40 - 70 % ) in coronary artery stenosis	common proximal and transitional mid - left heart circumflex disease with delayed intermediate coronary stenosis ( lumen tract reduction of 40 - 70 % ) ( originally considered equivalent only to two - cell vessel compartment disease ).
some proximal two - component or the three - axis vessel disease results with intermediate coronary stenosis resulted in requiring at least six twovessels ;	proximal inflammatory two - or rare three - lobe vessel open disease presents with intermediate depth coronary stenosis in at very least two vessels.
Acute myocardial infarction (3-5 days)	Acute myocardial infarction (3-5 days)
Unstable angina	Unstable angina
Uncontrolled arrhythmias causing symptoms or hemodynamic compromise	Uncontrolled arrhythmias causing symptoms or hemodynamic compromise
Syncope	Syncope
Active endocarditis	Active endocarditis
Acute myocarditis or pericarditis	Acute myocarditis or pericarditis
Symptomatic severe aortic stenosis	Symptomatic severe aortic stenosis
Uncontrolled heart failure	Uncontrolled heart failure
Acute pulmonary embolus or pulmonary infarction	Acute pulmonary embolus or pulmonary infarction
Thrombosis of lower extremities	Thrombosis of lower extremities
Suspected dissecting aneurysm	Suspected dissecting aneurysm
Uncontrolled asthma	Uncontrolled asthma
Pulmonary edema	Pulmonary edema
SpO2 = 85% on room air	SpO2 = 85% on room air
Acute respiratory failure	Acute respiratory failure
Acute non-cardiopulmonary disorder that may affect exercise performance or be aggravated by exercise (i.e., infection, renal failure, thyrotoxicosis)	Acute non-cardiopulmonary disorder that may affect exercise performance or be aggravated by exercise (i.e., infection, renal failure, thyrotoxicosis)
Mental impairment leading to inability to cooperate with the testing	Mental impairment leading to inability to cooperate with the testing
Absolute Contraindications	None of the above
Left main coronary artery stenosis or its equivalent	Left main coronary artery stenosis or its equivalent
Moderate stenotic valvular heart disease	Moderate stenotic valvular heart disease
Severe untreated arterial hypertension at rest (200mmHg systolic, 120mmHg diastolic)	Severe untreated arterial hypertension at rest (200mmHg systolic, 120mmHg diastolic)
Tachyarrythmias or bradyarrythmias	Tachyarrythmias or bradyarrythmias
High degree atrioventricular block	High degree atrioventricular block
Hypertrophic cardiomyopathy	Hypertrophic cardiomyopathy
Significant pulmonary hypertension	Significant pulmonary hypertension
Advanced or complicated pregnancies	Advanced or complicated pregnancies
Electrolyte abnormalities	Electrolyte abnormalities
Orthopedic impairment that prevents walking	Orthopedic impairment that prevents walking
Thrombosis of lower extremities	None of the above
Tolerable that provides vision and the patient’s needs desires.2	Tolerable refractive correction that provides vision and the needs and desires.
The patient’s lifestyle is not compromised cataract and able to perform activities living. 1,2	lifestyle is not by cataract and able perform activities daily living.
The patient safely surgery because of coexisting	patient cannot undergo surgery because of coexisting medical or conditions.
Surgery not improve visual function, or no other indication lens removal exists.1,2	Surgery is not expected to improve visual function, or no other indication for removal exists.
The patient’s lifestyle is not compromised cataract and able to perform activities living. 1,2	Simple Cataract Surgery.
Surgery not improve visual function, or no other indication lens removal exists.1,2	Surgery.
evaluation research of pulmonary, mediastinal, pleural and acute chest with wall wound infections and and of their complications	evaluation surveys of major pulmonary, mediastinal, upper pleural neck and chest cavity wall infections and their possible complications
patient detection trial and characterization testing of mediastinal disease neoplasms and other tumor processes	independent detection and characterization of viral mediastinal infectious neoplasms drugs and other cellular processes
standard assessment risk of chronic cardiopulmonary vascular failure syndrome or insufficiency	functional assessment of bilateral cardiopulmonary nerve failure brains or brain insufficiency
manual diagnosis of and / and or monitoring staging of neoplastic and hematologic development processes arising primarily in the external thorax or with potential involvement within of the intact thorax	diagnosis for and / or medical staging of neoplastic and benign hematologic disease processes when arising suddenly in the thorax in or with potential involvement cases of intra the thorax
detection and determination of these nature and their extent of cardiovascular heart abnormalities patients such as, including but not limited mainly to the aneurysm, dissection, pulmonary embolism, chronic thrombosis, congenital anomalies, postoperative complications and sequelae of an atherosclerotic disease	physical detection and clinical determination of nature presence and extent present of active cardiovascular abnormalities especially such as, but not universal limited to aneurysm, dissection, breath embolism, thrombosis, congenital anomalies, postoperative complications and sequelae consequence of primary atherosclerotic disease
for assessing adequately and / 2 or successfully guiding alternative drainage methods of pulmonary or pleural fluid during collections events such as abscess, acute empyema, effusion pulmonary or other pneumothorax	for assessing and / and or guiding drainage plans of acute pulmonary void or other pleural body fluid collections during such infections as abscess, abdominal empyema, effusion or associated pneumothorax
for independent characterizing and follow - up treatment evaluation of rare interstitial and alveolar tuberculosis lung disease primarily due to to severe idiopathic, extreme allergic, collagen - related vascular, critical environmental or other causes	for characterizing clinical and follow - up evaluation rates of interstitial and alveolar lung muscle disease diagnosis due typically to idiopathic, highly allergic, likely collagen - dependent vascular, local environmental stress or other causes
for evaluating thoracic sequelae components of numerous remote processes by including, to but though not limited it to, chronic pancreatitis, gastrointestinal wall perforation trauma and other pain processes	for patients evaluating thoracic obstruction sequelae of many remote pain processes including, but sometimes not limited access to, chronic pancreatitis, related gastrointestinal muscle perforation and other pain processes
for help assessing injury, usually potential injury incidence or resulting thoracic sequelae sustained after trauma, burn, surgery, renal transplantation, radiation therapy, acute chemotherapy or invasive procedure methods such as pacemaker placement, chest tube electrode placement procedures or mechanical ventilation	method for assessing injury, potential injury or related thoracic injury sequelae after trauma, burn, surgery, cardiac transplantation, radiation therapy, local chemotherapy or invasive other procedure procedures such as heart pacemaker placement, chest tube tube placement performed or mechanical ventilation
evaluation care of the chest patient deals with symptoms that may be arising principally from the lower chest, or be subsequently referred to the chest including but not limited areas to dry cough, hemoptysis, central chest pain, abdominal joint pain and others	evaluation of the patient with symptoms but that may typically be arising from inside the chest, or be referred to the chest also including but however not also limited any to breast cough, hemoptysis, chest lung pain, low abdominal pain and others
if to be further characterize a suspected brain abnormality further detected by another imaging test	to to further characterize having a suspected abnormality been detected by another video imaging test
evaluation image of a human patient identified with the myasthenia gravis not to completely rule out thymic tumors	diagnostic evaluation consisting of only a patient affected with myasthenia gravis to potentially rule out thymic duct tumors
provides performance data of both ct - guided biopsies and and emergency drainage procedures when fluoroscopy is being inadequate	performance of ct - guided surface biopsies wells and drainage channel procedures provide when fluoroscopy depth is not inadequate
"perhaps the most common symptom of an aortic dissection ( occurring in generally approximately 90 % of the cases ) is sudden, excruciating pain most commonly suddenly located in the anterior chest. most patients may describe the extreme pain described as "" cutting, "" "" ripping, "" or "" compression tearing "". but a sudden underlying neurologic episode usually accompanies the abrupt onset of most instances of "" painless "" aortic dissection."	"the present most common symptom of an aortic dissection ( occurring in approximately roughly 90 % of the cases ) is usually sudden, intense excruciating pain most commonly located in the anterior lower chest. patients may describe the pain often as "" cutting, "" "" severe ripping, "" or "" tearing "". a sudden neurologic episode usually generally accompanies the earliest onset events of most instances of "" painless "" aortic dissection."
clinical staging of for a single patient with prostate cancer in for whom alternative radical prostatectomy or surgical radiation treatment therapy is considered.	clinical staging of a developing patient with complex prostate cancer in men whom radical prostatectomy studies or radiation drug therapy results is considered.
evaluation of a patient screening following radical cell prostatectomy or prostate radiation therapy surgery for lingering prostate cancer or who already has rising prostate age specific growth antigen ( psa ) levels.	evaluation of to a human patient following radical prostatectomy or medical radiation treatment therapy monitoring for treatment prostate cancer treatment who has rising lethal prostate specific antigen ( psa ) ii levels.
a suspicion of prostatic kidney disease documented from the patient ’ s history, rectal internal examination, greater or a more clinically significant psa increase, head and / or breast bone scan evidence of metastasis without indicating a new diagnosis status of bladder prostate cancer	a low suspicion of primary prostatic disease documented from the patient ’ s oral history, past rectal external examination, research or a clinically considered significant psa increase, and / is or bone scan evidence indicating of tissue metastasis without a diagnosis of prostate cancer.
such transrectal ultrasound scan is allowed for early metastatic lesions sometimes of unknown source, with probably a particularly high psa receptor level, which thus could have their primary origin in the enlarged prostate.	metastatic localized lesions of unknown toxic source, with a comparatively high psa level, which could have suggested their origin found in nearby the male prostate.
mass infertility and azoospermia from where wearing an ejaculatory duct caused cyst formation is commonly suspected.	infertility failure and generalized azoospermia risk where likely an isolated ejaculatory bile duct cyst is suspected.
severe fever of unknown origin or where a short prostatic focus point is suspected.	suspected fever of unknown origin where a characteristic prostatic red focus pattern is suspected.
evaluation site of suspected bone prostatitis treatment or advanced prostatic vein abscess.	independent evaluation of some suspected bacterial prostatitis lesions or suspected prostatic abscess.
congenital and and sometimes acquired cystic conditions are of prostate, mature seminal vesicles, skin and its related tissues.	the congenital and acquired cystic conditions of prostate prostate, nuclear seminal vesicles, brain and any related fat tissues.
measuring of size / volume of prostate gland tissue prior to radiation therapy, or transurethral ultrasound needle ablation of of the prostate ( tuna ), or transurethral microwave patient thermotherapy ( tumt ), transurethral resection operation of the prostate ( turp ) and and laser ablation of abdominal prostate ( including “ green - light ” laser ).	measuring size / volume size of prostate tissue after prior application to radiation radiation tissue therapy, transurethral needle ablation of the prostate ( wet tuna ), or alternatively transurethral microwave prostate thermotherapy ( tumt ), \ n \ ntransurethral resection of the prostate ( turp ) and prostate laser ablation of prostate ( cad “ green - light ” laser ).
