input_text	target_text
"The most common symptom of an aortic dissection (occurring in approximately 90% of the cases) is sudden, torture pain nigh commonly site in the anterior chest. Patients may describe the painful sensation as "" cutting, "" "" ripping, "" or "" tear "". Adenine sudden neurological episode usually accompanies the onset of most instances of "" painless "" aortal dissection."	"The nigh common symptom of an aortal dissection (occurring in approximately 90% of the cases) is sudden, excruciating pain most commonly located in the anterior thorax. Patients may describe the pain as "" cut, "" "" ripping, "" or "" tear "". A sudden neurologic episode ordinarily accompanies the onset of most instance of "" painless "" aortic dissection."
Detection or of colon polyp(s) OR	or surveillance of colon polyp(s)
Diagnostic procedure when ANY of the following criteria are (3):	procedure when ANY of the following are met:
Secondary procedure after an incomplete diagnostic optical colonoscopy (OC) with adequate preparation, and complete evaluation of colon was not technically possible (1,2) when EITHER of the are met	of the above
of colon polyp(s) in previously diagnosed patients OR	Surveillance of polyp(s) in previously diagnosed patient.
Diagnostic procedure when ANY of the following criteria are (3):	Diagnostic procedure ANY of the following criteria are
Secondary procedure after an incomplete diagnostic optical colonoscopy (OC) with adequate preparation, and complete evaluation of colon was not technically possible (1,2) when EITHER of the are met	None of above
extreme severe obesity ( one bmi > 39 000 kg / 50 m2 )	persistent severe central obesity ( average bmi > 39 m3 kg / m2 )
the prior the placement of prosthetic cylinder valves	prior the placement of such prosthetic piston valves
no known severe local aortic knot stenosis	among known causes severe aortic bypass stenosis
prior placement of plastic grafts in coronary arteries bypass heart surgery	prior placement part of grafts in the coronary bypass medical surgery
suspicion of fatal acute coronary syndrome ( where elevated mi cells or severe unstable arterial angina have not completely been ruled out )	suspicion of acute nasal coronary syndrome ( particularly where significant mi level or unstable nasal angina symptoms have not been ruled out )
copper intracoronary system metallic copper stent	no intracoronary pulse metallic needle stent
status for post - heart assisted transplantation	full status post - acquired heart transplantation
no recent mi ( 30 working days old or less )	on recent 9 mi ( 30 million days or less )
with prior pacemaker or defibrillator approach lead valve placement	prior pacemaker or portable defibrillator may lead shoe placement
newly newly diagnosed systolic syndrome heart cluster failure, patients with no prior left hemisphere heart beat catheterization	two newly reported diagnosed major systolic heart failure, associated with no left prior or left heart catheterization
left main coronary artery disease continuous with or intermediated coronary vein stenosis ( a lumen reduction very less frequently than or easily equal to nearly 30 % )	left hemisphere main cause coronary artery disease combined with bilateral intermediated state coronary stenosis ( bilateral lumen reduction of less than 0 or equal to 30 % )
non - obstructing stenosis ( < to 50 % of all major epicardial vessels ) occurs on each cta or catherization in the past twelve \ n \ ncreated on period 10 / till 25 / 2021. compare page 4 examples of 11 \ n \ nmonths, in all the absence characteristic of a similar new symptom complex	non - obstructing stenosis ( < to 50 % removal of nearly all the major blood epicardial vessels ) on abnormal cta or catherization in earlier the past several twelve months, in to the absence of a new symptom risk complex
upper left main disease presenting with normal intermediate coronary stenosis ( a lumen eye diameter reduction of to 30 - to 50 % ) ;	left open main disease with intermediate coronary stenosis ( reduced lumen of diameter with reduction limits of usually 30 - 50 % )
proximal lower and mid - left posterior anterior side descending ( lad ) transverse coronary and artery artery disease with short intermediate arterial stenosis ( chest lumen reduction 40 - 70 % ) ;	left proximal branches and mid - peripheral left anterior flank descending ( lad ) coronary artery associated disease with large intermediate bilateral stenosis ( lumen reduction for 40 - normal 70 % )
various proximal and mid - left hemisphere circumflex disease with either intermediate grade coronary stenosis ( lumen or reduction around 40 - over 70 % ; ( previously considered as equivalent to symmetric two - vessel disease ) ;	proximal dorsal and mid - abdominal left flank circumflex terminal disease chronic with secondary intermediate disease coronary ligament stenosis ( lumen reduction from 40 - 70 % ; ( considered equivalent to progressive two - vessel disease )
proximal two - or three - nerve vessel disease with rare intermediate and coronary stenosis in and at its least sometimes two possible vessels ;	rare proximal two - vessels or rarely three - vessel disease with high intermediate pressure coronary stenosis in at least almost two small vessels
right lobe coronary lobe disease with normal intermediate ( lumen size reduction 40 - ≥ 70 % ) coronary disc stenosis	right hemisphere coronary disease with small intermediate ( single lumen reduction for 40 - nearly 70 % ) coronary portal stenosis
Tolerable refractive correction that inevitably provides vision and meets the patient’s needs and desires.2	Tolerable refractive correction that provides vision and visual modality meets the patient’s needs and desires.
The patient’s lifestyle is not compromised by the cataract and they are do able to perform activities of daily living. 1,2	The patient’s lifestyle is not activeness compromised by the cataract and they are able to perform activities of daily living.
The patient cannot safely undergo surgery affected role because of coexisting medical or ocular conditions.1,2	The patient or cannot safely undergo surgery because of coexisting medical or ocular conditions.
Surgery is not expected to improve amend visual function, or no other indication for lens removal exists.1,2	remotion Surgery is not expected to improve visual function, or no other indication for lens removal exists.
The patient’s lifestyle is not compromised by the cataract and they are do able to perform activities of daily living. 1,2	Simple Cataract wide eyed Surgery.
Surgery is not expected to improve amend visual function, or no other indication for lens removal exists.1,2	Complex Cataract cataract Surgery.
convulsion hyperactivity or any past of convulsion (except those induced by ECT or isolated convulsive convulsions in adulthood or second childhood without previous therapy or occurrence). supplementary reflection should be given for persons on drugs which may lower the convulsion probability or with environment rendering the patient of more susceptible to convulsions, such as as addiction;	convulsion hyperactivity or any past of convulsion (except those induced by ECT or isolated convulsive convulsions in adulthood or second childhood without previous therapy or occurrence). (Note: supplementary reflection should be given for persons on drugs which may lower the convulsion probability or with environment rendering the patient of more susceptible to convulsions, such as as addiction)
existence of nervus vagus sensory nerve pacemakers leads in the carotid artery medullary sheath;	existence of nervus vagus sensory nerve pacemakers leads in the carotid artery medullary sheath
existence of an implanted medical examination apparatus located <30 centimeters from the TMS magnetic moment primary coil, including but not limited\n\nCreated on 10/25/2021. paper 4 of 24\n\nto cardiac pacemaker, implanted implantable, or nervus vagus sensory nerve flight simulator.	existence of an implanted medical examination apparatus located <30 centimeters from the TMS magnetic moment primary coil, including but not limited to cardiac pacemaker, implanted implantable, or nervus vagus sensory nerve flight simulator
seizure personality disorder or any history because of seizure ( except those induced by ect or isolated febrile seizures in particular infancy or or childhood... without subsequent treatment or recurrence ). additional consideration then should be given specifically for other individuals located on medications which may lower the seizure threshold or with conditions rendering the patient more prone to seizures, such as with alcoholism ;	seizure disorder or any early history of seizure ( except those induced by ect or isolated febrile seizures only in their infancy alone or childhood without subsequent treatment or recurrence ). ( note : additional consideration should be given for individuals on medications which may lower the initial seizure threshold or with conditions risk rendering the patient instead more typically prone to seizures, such such as juvenile alcoholism )
a presence alone of other vagus nerve stimulators usually leads in reducing the outer carotid sheath ;	further presence of vagus muscular nerve and stimulators leads in damaging the anterior carotid sheath
unusual presence of an implanted medical device located < 30 cm from the tms magnetic coil, including but not so limited \ delta n \ ncreated sample on 10 / 25 / sol 2021. page 4 of 24 \ delta n \ nto test pacemakers, implanted defibrillators, nasal or vagus artery nerve injury simulators.	and presence of such an approximately implanted electric medical device located < level 30 cm from the tms electrical magnetic coil, including but not always limited also to pacemakers, implanted defibrillators, or even vagus spinal nerve simulators
iliac deep vein muscle compression syndrome also known variously as von may - thurner or de cockett anderson syndrome	iliac vein shaft compression syndrome but also variously known as van may - alexander thurner or cockett notch syndrome
superior iliocaval nerve obstruction	upper iliocaval valve obstruction
iliofemoral obstruction for patients currently with venous leg ulceration ( s ) not being relieved by conservative therapies and compression. progression of symptoms may lead directly to phlegmasia cerulea e dolens ( long pcd ), acute inferior vena cava ( ivc ) thrombosis, and rapid thrombus cuff extension despite minimal anticoagulation as well as anatomically extensive dvt affecting the common femoral and / del or iliac vein, or post - thrombotic stenosis combined with typical ankle edema of venous origin ( i. e., minimum ceap score 3 ).	iliofemoral joint obstruction for patients associated with venous leg and ulceration ( s ) not relieved by conservative therapies injection and compression. progression of symptoms may lead to phlegmasia cerulea dolens ( pcd ), excessive acute inferior vena cava ( an ivc ) thrombosis, and rapid thrombus extension despite anticoagulation as well as the anatomically extensive dvt reactions affecting the common femoral limb and / or iliac radial vein, or post - thrombotic stenosis with ankle edema of venous origin ( i. e., minimum ceap score 3 ).
of superior or inferior inferior vena systemic caval system thrombosis including superior intrinsic vena pro cava syndrome	superior posterior or inferior abdominal vena caval cancer thrombosis including abnormal superior inferior vena da cava syndrome
in post - normal thrombotic surgical syndrome ( 1 pts ).	post - congenital thrombotic heart syndrome ( pre pts )
as as an adjunct to catheter - assisted directed thrombolysis for treating acute femoroiliocaval vi deep neural vein thrombosis mri when applied post dose thrombolysis imaging methods identifies symptomatic residual heart stenosis	available as either an adjunct agent to catheter - directed directed thrombolysis used for certain acute acute femoroiliocaval deep right vein thrombosis when in post thrombolysis ct imaging identifies symptomatic residual stenosis
post radiation hospital venous artery stenosis	benign post surgical radiation venous stenosis
symptomatic post - traumatic pressure venous bleeding stenosis including by those resulting from central primary venous catheters or external transvenous delivery device ( e. g., pacemakers, defibrillators, ) without pacemaker leads or a short history point of abdominal and / or pelvic closure surgery.	symptomatic or post - orbital traumatic venous stenosis including those resulting from combined central venous catheters or central transvenous device ( compare e. g., pacemakers, chest defibrillators, ) pacemaker leads or after a history of abdominal and / or or cervical pelvic cancer surgery.
salvage of thrombosed or stenotic symptomatic or limited function arteriovenous dialysis access artery fistulae or grafts with often compromised venous outflow, failed angioplasty rapid restenosis, or vessel perforation. this may include treatment of trapping a life threatening thrombus, an aneurysm deficiency or pseudoaneurysm that threatens the viability of the av fistula device or vascular graft, or include the emergency treatment of presenting a hemodialysis vascular access artery rupture that cannot immediately be controlled through balloon tamponade.	salvage of thrombosed duct or stenotic symptomatic or limited function arteriovenous dialysis access fistulae or grafts with compromised venous vascular outflow, failed angioplasty rapid restenosis, or vessel perforation. this may include treatment of trapping a life threatening thrombus, an onstage aneurysm or pseudoaneurysm that threatens the viability of the av operative fistula or graft, and or the alternative treatment of a hemodialysis involving vascular access rupture surgery that itself cannot be controlled through balloon removal tamponade.
focal thrombotic obstruction of both major lateral hepatic renal veins ( ne budd - la chiari syndrome. )	rare thrombotic valve obstruction syndrome of certain major internal hepatic veins ( budd - chiari syndrome. )
small transvenous veins decompression pumps of and portosystemic heart shunts	blood transvenous antibodies decompression components of blood portosystemic cardiac shunts
post - operative stenosis failure or venous narrowing due to repair failure of congenital deep cardiac disease, at e. lower g. sinus nerve venosus atrial transverse septal defect ( asd ), usually discordant ligament atrioventricular connection status on post mustard or senning repair of transposition of the great arteries ( tga ).	a post - operative stenosis or venous narrowing due to repair of congenital cardiac heart disease, e. g. median sinus congenital venosus atrial junction septal defect ( asd ), discordant defect atrioventricular connection status due post radiation mustard or senning on repair of congenital transposition of the great arteries ( tga ).
chronic pulmonary vein muscular stenosis resulting from congenital vein malformation, extrinsic compression, sequelae of reduced radiofrequency ablation ( rfa ), abnormal lung transplantation, or status post valve repair failure of total anomalous fusion pulmonary balloon vein chest return ( tapvr ).	pulmonary vein stenosis resulting from acute congenital heart malformation, extrinsic vein compression, sequelae of radiofrequency ablation ( rfa ), pulmonary lung transplantation, cancer or medical status post surgical repair defect of early total anomalous pulmonary vein return ( minimal tapvr ).
Severe obesity (BMI > spartan 39 kg/m2)	Severe obesity corpulency (BMI > 39 kg/m2)
Prior valve placement of prosthetic valves	Prior placement of anterior prosthetic valves
aortal Known severe aortic stenosis	spartan Known severe aortic stenosis
coronary thrombosis Prior placement of grafts in coronary bypass surgery	Prior placement of grafts in graft coronary bypass surgery
Suspicion stat mi of acute coronary syndrome (where MI or unstable angina have not been ruled out)	Suspicion of acute misgiving coronary syndrome (where MI or unstable angina have not been ruled out)
metal Intracoronary metallic stent	metal Intracoronary metallic stent
Status post-heart status transplantation	status Status post-heart transplantation
Recent MI stat mi (30 days or less)	Recent MI (30 holocene days or less)
Prior pacemaker or cardiac pacemaker defibrillator lead placement	Prior pacemaker or defibrillator lead guide placement
Newly diagnosed systolic heart failure, allow with no prior left heart catheterization	Newly essence diagnosed systolic heart failure, with no prior left heart catheterization
Left main coronary artery disease with Intermediated Coronary Stenosis (lumen reduction less than or equal to to a lesser extent 30%)	Left coronary thrombosis main coronary artery disease with Intermediated Coronary Stenosis (lumen reduction less than or equal to 30%)
Non-obstructing stenosis (<50% of all major john roy major epicardial vessels) on CTA or catheterization in the past twelve months, in the absence of a new symptom complex.	Non-obstructing stenosis (<50% of all yesteryear major epicardial vessels) on CTA or catheterization in the past twelve months, in the absence of a new symptom complex.
Left main disease with medium intermediate coronary stenosis (lumen diameter reduction of 30-50%);	Individual’s CCTA analysis is psychoanalysis completed.
Proximal and mid-left anterior descending (LAD) coronary artery disease with derive intermediate coronary stenosis (lumen reduction 40-70%);	Left main disease with intermediate coronary stenosis coronary thrombosis (lumen diameter reduction of 30- 50%)
Proximal and mid-left circumflex disease with intermediate coronary stenosis (lumen reduction 40-70%) stricture (considered equivalent to two-vessel disease);	Proximal and mid-left anterior medium descending (LAD) coronary artery disease with intermediate coronary stenosis (lumen reduction 40-70%)
Right coronary disease with intermediate (lumen reduction 40-70%) coronary decrease stenosis	Proximal and mid-left circumflex medium disease with intermediate coronary stenosis (lumen reduction 40-70%) (considered equivalent to two-vessel disease).
Proximal two- or three-vessel disease with proximal intermediate coronary stenosis in at least twovessels;	Proximal two- or three-vessel disease with intermediate coronary stenosis in stricture at least two vessels.
Diagnose and manage medically and surgically retinal and neuro - ophthalmic diseases which involve changes in the optic face, subretinal and intraretinal changes, vitreo - retinal relationships and changes in the boldness fiber bed.	Diagnose and make do medically and surgically retinal and neuro - ophthalmic disease which imply changes in the optic cheek, subretinal and intraretinal changes, vitreo - retinal relationship and changes in the nerve fibre bed.
Diagnose other glaucoma and monitor lizard glaucoma treatment	Diagnose early glaucoma and monitor glaucoma discussion.
Differentiate causal agency of early ocular mettle disorders when a diagnosis is in doubt.	Differentiate causa of other optical nerve disorders when a diagnosis is in question.
Diagnose and manage the patient role ' s condition when visual field results are deficient; beaver state when reliable visual field testing cannot live execute, ascribable to visual, strong arm, mental, or age constraints.	Diagnose and manage the patient ' s condition when visual field results are deficient; or when true visual field try cannot be performed, referable to visual, strong arm, mental, or age constraint.
Differentiate when a discrepancy exists between the clinical appearance of the optic nerve and the ocular field	Differentiate when a discrepancy be between the clinical show of the optic face and the ocular fields.
Detect farther loss of ocular brass or retinal nerve roughage layer changes in the presence of in advance optic nerve damage and advanced visual field loss	Detect further loss of optical face or retinal spunk fiber stratum changes in the presence of advanced optical nerve damage and advanced visual field personnel casualty.
Follow glaucoma suspects.	Follow glaucoma suspects.
Evaluate narrow slant, surmise narrow slant, mixed narrow and subject angle glaucoma, and angle receding as all determined by gonioscopy	Evaluate minute angle, suspected narrow angle, mixed narrow and open slant glaucoma, and angle recess as all ascertain by gonioscopy.
Ascertain the proper intraocular crystalline lens for a patient role who has had prior refractive operating room and now requires cataract extraction	Determine the right intraocular lens for a patient who bear had prior deflective surgery and now requires cataract descent.
Evaluate and plan treatment for patients with disease affect the cornea, fleur de lis, lens system and other anterior section structures.	Evaluate Sword lily neoplasm.
Evaluate corneal edema or opacity that precludes visualisation or bailiwick of the prior bedchamber	Evaluate corneal oedema or opacity that precludes visual image or discipline of the anterior chamber.
Calculate lens power for cataract patient who get undergone prior refractive surgery. (Reimbursement will only be made for the cataract codes as long as extra documentation is available in the patient record of the prior refractive procedure. Reimbursement leave non be made in addition to A - cat scan or IOL master. )	Calculate lens power for cataract patients world health organization have undergone prior refractive surgery. (Reimbursement will only exist made for the cataract codes equally long as additional documentation is available in the patient record of the anterior refractive operation. Reimbursement will not be made in addition to A - cat scan or IOL maestro. )
Provide extra info during the planning and come - up for corneal, iris, cataract, glaucoma and other anterior segment surgeries.	Evaluate and programme handling for patients with diseases affecting the cornea, iris, lens and other anterior segment structure.
medication refractory ET (defined as refractory at least two trials of medical including at least first-line agent)	medication refractory ET (defined refractory to at least two trials of medical therapy, including at one first-line agent)
to severe postural or tremor of the dominant hand or nationally accepted clinical measure of tremor	moderate to postural or intention tremor of the or another nationally accepted clinical measure of severity
disabling (defined by score of any of the eight items in the disability subsection of the CRST or another nationally of tremor severity)	disabling ET (defined by a of any of the eight items in the disability subsection the CRST or another nationally accepted clinical measure severity)
not a candidate DBS (e.g., advanced age, anticoagulant therapy, surgical comorbidities, or has failed Stimulation (DBS), has no retained cranial	a candidate for (e.g., advanced age, therapy, surgical or has failed Deep Brain Stimulation has no retained cranial implants)
Iliac vein compression syndrome also known as May-Thurner or Cockett syndrome	Iliac vein compression syndrome also known as May-Thurner or Cockett syndrome
Iliocaval obstruction	Iliocaval obstruction
Iliofemoral obstruction for patients with venous leg ulceration(s) not relieved by conservative therapies and compression. Progression of symptoms may lead to Phlegmasia Cerulea Dolens (PCD), acute inferior vena cava (IVC) thrombosis, and rapid thrombus extension despite anticoagulation as well as anatomically extensive DVT affecting the common femoral and/or iliac vein, or post-thrombotic stenosis with ankle edema of venous origin (i.e., minimum CEAP score 3).	Iliofemoral obstruction for patients with venous leg ulceration(s) not relieved by conservative therapies and compression. Progression of symptoms may lead to Phlegmasia Cerulea Dolens (PCD), acute inferior vena cava (IVC) thrombosis, and rapid thrombus extension despite anticoagulation as well as anatomically extensive DVT affecting the common femoral and/or iliac vein, or post-thrombotic stenosis with ankle edema of venous origin (i.e., minimum CEAP score 3).
Superior or Inferior Vena Caval Thrombosis including Superior Vena Cava syndrome	Superior or Inferior Vena Caval Thrombosis including Superior Vena Cava syndrome
Post-thrombotic syndrome (PTS).	Post-thrombotic syndrome (PTS)
As an adjunct to catheter-directed thrombolysis for acute femoroiliocaval deep vein thrombosis when post thrombolysis imaging identifies symptomatic residual stenosis	As an adjunct to catheter-directed thrombolysis for acute femoroiliocaval deep vein thrombosis when post thrombolysis imaging identifies symptomatic residual stenosis
Post radiation venous stenosis	Post radiation venous stenosis
Symptomatic post-traumatic venous stenosis including those resulting from central venous catheters or transvenous device (e.g., pacemakers, defibrillators,) pacemaker leads or a history of abdominal and/or pelvic surgery.	Symptomatic post-traumatic venous stenosis including those resulting from central venous catheters or transvenous device (e.g., pacemakers, defibrillators,) pacemaker leads or a history of abdominal and/or pelvic surgery.
